{
  "id": "a8814251-1e08-49c2-9f3a-5773adcfee10",
  "courseId": "test-course",
  "lectureId": "test-001",
  "presetId": "exam-mode",
  "artifactType": "key-terms",
  "generatedAt": "2026-02-11T09:32:48.248331+00:00",
  "version": "0.2",
  "threadRefs": [
    "b3d7250f-5901-4c41-91e3-1cb66c08c18f",
    "638ea655-2b98-4961-8546-781c2043b105",
    "f50e7c7a-f48f-4f0c-a618-2ce4da7163d1"
  ],
  "terms": [
    {
      "term": "Core process",
      "definition": "The fundamental mechanism of the system.",
      "example": "Example: how component A transforms input to output."
    },
    {
      "term": "Optimization factor",
      "definition": "Element that enhances efficiency or speed.",
      "threadRef": "b3d7250f-5901-4c41-91e3-1cb66c08c18f"
    }
  ]
}
