{
  "id": "7cc33e99-768e-494a-b247-8a615ba6fb50",
  "courseId": "course-001",
  "lectureId": "test-beginner",
  "presetId": "beginner-mode",
  "artifactType": "key-terms",
  "generatedAt": "2026-02-11T09:33:47.109866+00:00",
  "version": "0.2",
  "threadRefs": [
    "2c5e7d74-d171-4e8c-9dca-704c0ab9f42d",
    "b14644ae-ac3e-4093-ba7d-c94d03250d67",
    "02dcda68-b5ba-4465-9797-834087a28b27"
  ],
  "terms": [
    {
      "term": "Main concept",
      "definition": "A fundamental principle or mechanism in this topic.",
      "threadRef": "2c5e7d74-d171-4e8c-9dca-704c0ab9f42d"
    },
    {
      "term": "Key factor",
      "definition": "An important element that affects the process."
    }
  ]
}
